"Please specify different value for ""%s"" attribute. Customer with such value already exists.","ขออภัย""%s""ของท่านซ้ำกับสมาชิกที่มีอยู่แล้วกรุณาตรวจสอบอีกครั้ง"
"Please select City","เลือก"
"Please select Subdistrict","เลือก"
"Thank you for registering","ขอบคุณสำหรับการสมัครสมาชิก"
"May you enjoy shopping to do.","ขอให้มีความสุขกับการช้อปปิ้ง"
"You will be redirected to our homepage in 3 seconds.","คุณจะกลับไปหน้าแรกภายใน 3 วินาที"
"Customer area","ข้อมูลลูกค้า"
"customer area","ข้อมูลลูกค้า"
"My Cart","รถเข็นของฉัน"
"Hi!","สวัสดี !"
"Account","บัญชีของฉัน"
"Welcome to your account","หน้าแรก"
"Logout","ออกจากระบบ"
"My Customer Area","ข้อมูลของฉัน"
"My orders & after  sales service","ข้อมูลของฉันและบริการหลังการขาย"
"My vouchers & refunds","บัตรกำนัลและการคืนเงินของฉัน"
"My Purchase voucher & Refunds","บัตรกำนัลและการคืนเงินของฉัน"
"My Purchase voucher  Refunds","บัตรกำนัลและการคืนเงินของฉัน"
"My Pending Reviews","รายการรอการรีวิว"
"My personal data","ตั้งค่าบัญชีการใช้งาน"
"My Account / My Password","บัญชีของฉัน / รหัสผ่านของฉัน"
"My Address","ที่อยู่ของฉัน"
"Newsletter Subscriptions","จดหมายข่าวของฉัน"
"Need Help?","ต้องการความช่วยเหลือ?"
"NEED HELP?","ต้องการความช่วยเหลือ?"
"FAQ","คำถามที่พบบ่อย"
"Color","สี"
"SEARCH","ค้นหา"
"Rating Filter","คะแนน"
"Categories","สินค้าทั้งหมด"
"Best sellers","สินค้าขายดี"
"Mobiles and Tablets","โทรศัพท์มือถือ & แท็บเล็ต"
"Popular searches:","คำยอดนิยม :"
"Search entire store here...","ค้นหาสินค้าทั้งหมดที่นี่ ..."
"View Products","ดูสินค้า"
"View cart","ดูตะกร้าสินค้า"
"Wishlist","สินค้าโปรด"
"Coupon Codes","รหัสส่วนลด"
"Enter your coupon code","กรอกรหัสส่วนลดของคุณ"
"Billing Information","ข้อมูลสำหรับออกใบเสร็จ"
"Same as shipping address","ใช้ที่อยู่เดียวกับที่อยู่จัดส่ง"
"Add new billing address","เพิ่มที่อยู่ใหม่สำหรับออกใบเสร็จ"
"Full Invoice","ต้องการใบกำกับภาษี"
"Tax Id","หมายเลขประจำตัวผู้เสียภาษี"
"order summary","สรุปรายการสั่งซื้อ"
"Billing","ที่อยู่สำหรับออกใบเสร็จ"
"Continue","เลือกซื้อสินค้าอื่นๆต่อ"
"Select store:","กรุณาเลือกสาขา"
"Choose shipment method for %s","เลือกวิธีการจัดส่งสำหรับ %s"
"Pay","สั่งซื้อ"
"Shipment","ค่าจัดส่ง"
"My Account & Password","บัญชีของฉัน & รหัสผ่านของฉัน"
"My Order","รายการสั่งซื้อสินค้าของฉัน"
"Total:","ยอดสุทธิ :"
"saving","ประหยัด"
"Order Details","รายละเอียดการสั่งซื้อ"
"Grand Total","ยอดสุทธิ"
"Subtotal","ราคาสินค้า"
"Shipping & Handling","ค่าจัดส่ง"
"My latest orders","รายการสั่งซื้อล่าสุดของฉัน"
"Status","สถานะ"
"Status :","สถานะ :"
"Date","วันที่"
"Show all my orders","แสดงรายการสั่งซื้อทั้งหมดของฉัน"
"Tracking status","ติดตามสถานะ"
"Quantity:","จำนวน:"
"In preparation","จัดสินค้า"
"Prepared","จัดสินค้าเรียบร้อย"
"Handed over to carrier","ส่งมอบให้กับผู้ให้บริการ"
"Delivered","ส่งสินค้าเรียบร้อย"
"Order No.","หมายเลขรายการสินค้า"
"Show all","แสดงข้อมูลทั้งหมด"
"See my order","ดูรายการสั่งซื้อของฉัน"
"Please Select Order To View","กรุณาเลือกรายการสั่งซื้อ"
"Receive date :","วันที่ใช้งาน :"
"Expire date :","วันที่หมดอายุ :"
"Read terms and conditions","อ่านข้อกำหนดและเงื่อนไข"
"Not use","สามารถใช้งานได้"
"My account and password ","บัญชีของฉัน & รหัสผ่านของฉัน"
"Edit account","แก้ไขบัญชีผู้ใช้"
"Default Language","ภาษา"
"Interest","ความสนใจ"
"My address book","ที่อยู่ของฉัน"
"All Address","ที่อยู่ทั้งหมด"
"New address","สร้างที่อยู่ใหม่"
"My wishlist","สินค้าที่ชอบ"
"You have no items in your wishlist.","คุณไม่มีรายการสินค้าในรายการที่ชอบ"
"General Subscription","สมัครสมาชิกจดหมายข่าว"
"No Pending Reviews","ไม่มีความคิดเห็น"
"saving : %s","ประหยัด : %s"
"Promo code","รหัสโปรโมชั่น"
"Month","เดือน"
"Year","ปี"
"Our Newsletter","รับข้อเสนอและข่าวสารใหม่ จาก Cmart"
"Our Partner Newsletter","รับข้อมูลและข่าวสารจากร้านค้าในเครือของเรา"
"You are currently not subscribed to any newsletter.","สมัครสมาชิกจดหมายข่าว"
"You are now logged out","ท่านได้ออกจากระบบแล้ว ขอบคุณที่ใช้บริการช้อปปิ้งออนไลน์"
"You have logged out and will be redirected to our homepage in 5 seconds.","คุณได้ออกจากระบบเรียบร้อยแล้วและจะกลับไปยังหน้าแรกของเว็บไซต์ใน 5 วินาที"
"New Customer?","คุณยังไม่เป็นสมาชิก?"
"Login or Register","เข้าสู่ระบบ หรือ สมัครสมาชิก"
"Login to continue","เข้าสู่ระบบเพื่อดำเนินการต่อ"
"Are you a new Cmart customer ?","คุณเป็นลูกค้าใหม่ CMART หรือไม่?"
"connect to your Facebook account","เชื่อมต่อกับบัญชี Facebook ของคุณ"
"Connect to your Facebook account","เชื่อมต่อกับบัญชี Facebook ของคุณ"
"Create account with your Facebook account","สร้างบัญชีใหม่ผ่านบัญชี Facebook ของคุณ"
"Forgotten password ?","ลืมรหัสผ่าน ?"
"Password confirmation","ยืนยันรหัสผ่าน"
"Get the best offers","รับข้อเสนอที่ดีที่สุด"
"subscribe and receive our special deals","สมัครและได้รับข้อเสนอพิเศษสุดจาก CMART"
"ENTER YOUR E-MAIL HERE...","กรอกอีเมลของคุณ ..."
"Item was removed successfully.","ลบสินค้าออกจากรถเข็นเรียบร้อยแล้ว"
"Have you already added product into Cart, please ","รถเข็นของคุณพร้อมใช้งานแล้ว กรุณา"
"login","เข้าสู่ระบบ"
"Are you sure you would like to remove this item from shopping cart?","คุณต้องการล้างสินค้าออกจากรถเข็นใช่ไม"
"you have added","คุณได้เพิ่มสิค้า"
"to your cart","ลงในรถเข็น"
"Forgot password?","ลืมรหัสผ่าน ?"
"Your cart is empty!","รถเข็นสินค้าของคุณว่างเปล่า!"
"Login or Register","เข้าสู่ระบบ หรือ สมัครสมาชิก"
"Login to continue","เข้าสู่ระบบเพื่อดำเนินการต่อ"
"connect to your Facebook account","เชื่อมต่อกับบัญชี Facebook ของคุณ"
"Create account with your Facebook account","สร้างบัญชีด้วยบัญชี Facebook ของคุณ"
"Password confirmation","ยืนยันรหัสผ่าน"
"Your password must be between 8 and 30 characters. It must have at least one letter and a digit (0-9)","รหัสผ่านของคุณต้องมีจำนวน 8-30 ตัวอักษร ประกอบด้วยอักขระอย่างน้อยหนึ่งตัวและตัวเลข (0-9)"
"Security low","ความปลอดภัยต่ำ"
"Security medium","ความปลอดภัยปานกลาง"
"Security high","ความปลอดภัยสูง"
"New Customer?","ลูกค้าใหม่?"
"Have you already added product into Cart, please ","คุณได้เพิ่มสินค้าลงรถเข็นหรือยัง กรุณา "
"login","เข้าสู่ระบบ"
"1 star","1 ดาว"
"2 stars","2 ดาว"
"3 stars","3 ดาว"
"4 stars","4 ดาว"
"5 stars","5 ดาว"
"Review","รีวิว"
"Nickname","ชื่อ"
"Product Name","ชื่อสินค้า"
"Get best offer","จดหมายข่าว"
"subscribe and receive our special deals","สมัครสมาชิกจดหมายข่าวเพื่อรับสิทธิพิเศษ"
"Login with Facebook","เข้าสู่ระบบผ่าน facebook"
"HELLO! %s","สวัสดี! %s"
"From your My Account Dashboard you have the ability to view a snapshot of your recent account activity and update your account information. Select a link below to view or edit information.","ในบัญชีของฉัน สามารถดูภาพรวมของกิจกรรมในบัญชีล่าสุดของคุณและอัปเดตข้อมูลบัญชีของคุณ คลิกที่ลิงค์ด้านล่างเพื่อดูหรือแก้ไขข้อมูล"
"get best offers","รับข้อเสนอที่ดีที่สุด"
"Click here","คลิก ที่นี่"
"Write a Review","แสดงความคิดเห็น"
"Write a review","แสดงความคิดเห็น"
"More info","ข้อมูลเพิ่มเติม"
"Associated products","ผลิตภัณฑ์ที่เกี่ยวข้อง"
"Detailed Description:","คำอธิบายโดยละเอียด :"
"Product Description:","รายละเอียดสินค้า:"
"Customer Reviews","ความคิดเห็นของลูกค้า"
"Rate this product","ให้คะแนนสินค้านี้"
"Posted by","โพสโดย"
"Review Title","หัวข้อรีวิว"
"Review Description","แจ้งรายละเอียด"
"Related products","สินค้าที่เกี่ยวข้อง"
"Sold & Fulfill by <strong>%s</strong>","ขายและดำเนินการส่งโดย <strong>%s</strong>"
"Phone Number","โทรศัพท์"
"Fill in the information of my account below.","กรุณากรอกข้อมูลบัญชีของฉัน"
"or Fill in the form below.","หรือกรอกฟอร์มด้านล่างเพื่อติดต่อเรา"
"Male","ชาย"
"Female","หญิง"
"I have read and understood the","ฉันได้อ่านและยอมรับ"
"terms & conditions","ข้อกำหนดและเงื่อนไข"
"Signup","สมัครสมาชิกใหม่"
"Subscribe to Our Newsletter","สมัครรับข้อเสนอและข่าวสารใหม่ จาก Cmart"
"Subscribe to our newsletter","สมัครรับข้อเสนอและข่าวสารใหม่ จาก Cmart"
"Subscribe to pertners newsletter","สมัครรับข้อมูลและข่าวสารจากร้านค้าในเครือของเรา"
"Thank you for registering with %s.","ขอขอบคุณสำหรับการลงทะเบียนกับ %s"
"You are currently subscribed to our newsletter","คุณได้สมัครรับจดหมายข่าวของเราแล้ว"
"Delivery to you in %s days in Bangkok area.","จัดส่งสินค้าให้กับคุณภายใน %s วันในเขตกรุงเทพมหานคร"
"Text length does not satisfy specified text range.","กรุณากรอกตัวเลขให้ครบ 10 หลัก"
"Please enter a valid number in this field.","กรุณากรอกตัวเลขเท่านั้น"
"return to homepage","กลับสู่หน้าแรก"
"Purchase On.","สั่งซื้อในวันที่"
"Your order was successful","รายการสั่งซื้อของคุณเสร็จเรียบร้อยแล้ว"
"Thank you for shopping with us","ขอขอบคุณสำหรับการช้อปปิ้งกับเรา"
"The account information has been saved.","ข้อมูลบัญชีของคุณได้รับการบันทึกเรียบร้อยแล้ว"
"Thank you for your subscription.","ขอบคุณสำหรับการสมัครรับข่าวสาร"
"Your review has been accepted for moderation.","ขอบคุณสำหรับความคิดเห็น<br>ข้อความของคุณอยู่ระหว่างการตรวจสอบ"
"<span>Free Delivery</span> at Pick up point!","<span>ฟรีค่าจัดส่ง</span>"
"You can follow at any time for your order at your","คุณสามารถติดตามรายการสั่งซื้อของคุณใน"
"for registered customers or at order tracking for guest customers.","สำหรับลูกค้าที่ลงทะเบียนหรือติดตามการสั่งซื้อสำหรับลูกค้าที่ไม่ลงทะเบียน"
"If there is an account associated with %s you will receive an email with a link to reset your password.","กรุณาตรวจสอบอีเมลของท่าน ระบบได้ทำการส่งลิงค์สำหรับการตั้งค่ารหัสผ่านไปยังอีเมล %s เรียบร้อยแล้ว"
"When you are purschasing, another customer have bought this deal product(s). Please edit your item quantity","ขออภัยรายการสินค้าพิเศษตอนนี้หมดสต๊อคแล้ว กรุณาแก้ไขตะกร้าของคุณ"
"Order No. %s - Total: %s","หมายเลขสั่งซื้อ %s - ราคารวม: %s"
"Delivery Scheduled at the <strong> %s </strong>","กำหนดการส่งมอบในวันที่ <strong> %s </strong>"
"My Reviews","การรีวิวของฉัน"
"My Product Reviews","ความคิดเห็นเกี่ยวกับสินค้า"
"View Details","ดูรายละเอียด"
"No. %s","หมายเลขสั่งซื้อ %s"
"Help","ช่วยเหลือ"
"Login / Register","เข้าสู่ระบบ / สมัครสมาชิก"
"Customer Zone","ข้อมูลลูกค้า"
"CATEGORIES","หมวดหมู่"
"The subscription has been saved.","ติดตามข่าวสารเรียบร้อยแล้ว"
"The subscription has been removed.","ยกเลิกติดตามข่าวสารเรียบร้อยแล้ว"
"Product is currently out of stock, please remove item(s) from cart.","ไม่มีสินค้าในคลัง/ กรุณาลบรายการสินค้า"
"you have added <span class=""count"">%s item(s) </span> to your cart","คุณได้เพิ่มสินค้า <span class=""count"">%s รายการ </span> ลงในตะกร้าแล้ว"
"QUICK VIEW","ดูรายละเอียดสินค้า"
"My Shopping Cart <span>%s item(s)</span>","สินค้าในตะกร้า <span>%s รายการ</span>"
"Forgot password","ลืมรหัสผ่าน"
"Please enter your email address below. You will receive a link to reset your password.","กรุณากรอกที่อยู่อีเมลของคุณด้านล่าง คุณจะได้รับลิงค์ในอีเมลเพื่อรีเซ็ตรหัสผ่านของคุณ"
"Please enter your email address and password below.","กรุณากรอกที่อยู่อีเมลและรหัสผ่านของคุณด้านล่าง"
"Credit Card Holder Name","ชื่อผู้ถือบัตรเครดิต"
"Credit Card Number","หมายเลขบัตรเครดิต"
"Card number","หมายเลขบัตร"
"Expiration Date","วันหมดอายุ"
"Card Verification Number","หมายเลขยืนยันหลังบัตร"
"Pay through direct debit","ชำระเงินผ่านการหักบัญชีธนาคาร"
"Pay at over the counter","ชำระเงินที่เคาน์เตอร์"
"Pay at ATM machine","ชำระเงินที่ตู้เอทีเอ็ม"
"Pay at Bank Counter","ชำระเงินที่เคาน์เตอร์ธนาคาร"
"Pay at Internet Banking","ชำระเงินทีอินเทอร์เน็ตแบงก์กิ้ง"
"You will be redirected to 1-2-3 Payment Gateway when you place an order.","คุณจะถูกนำไปชำระเงินประเภท 1-2-3 เมื่อคุณสั่งซื้อสินค้า"
"You will be redirected to 2C2P Payment Gateway when you place an order.","คุณจะถูกนำไปชำระเงินประเภท  วีซ่าหรือมาสเตอร์การ์ด เมื่อคุณสั่งซื้อสินค้า"
"Use default shipping address","ใช้ที่อยู่สำหรับจัดส่งสินค้าหลัก"
"Use default billing address","ใช้ที่อยู่สำหรับออกใบเสร็จหลัก"
"Use another address","ใช้ที่อยู่อื่น"
"Add new shipping address","เพิ่มที่อยู่จัดส่งใหม่"
"Select Address","เลือกที่อยู่"
"Save in address book","บันทึกในสมุดที่อยู่"
"Click <a href="%s">here</a> to continue shopping.","คลิก <a href="%s">ที่นี้</a> เพื่อดำเนินการช้อปปิ้งต่อ"
"Are you sure you want to remove this product from your wishlist?","คุณแน่ใจหรือไม่ ว่าคุณต้องการลบสิ่งที่ชอบของคุณจากสินค้านี้"
"ITEMS FOUND","สินค้าที่พบ"
"More offer","ข้อเสนอเพิ่มเติม"
"Not Yet Rated","ยังไม่ได้ประเมิน"
"Page:","หน้า:"
"<span>%s</span> Item(s)","<span>%s</span> รายการ"
"Search results for %s","ผลการค้นหาสำหรับ %s"
"products","สินค้า"
"Free Delivery","จัดส่งฟรี"
"Free delivery","จัดส่งฟรี"
"Item(s)","รายการ"
"Search results for: '%s'","ผลการค้นหาสำหรับ: '%s'"
"Spend more %s to get free delivery (Pickup Point Only)","ซื้อสินค้าเพิ่มอีก %s คุณจะได้รับบริการจัดส่งฟรี (เฉพาะรับสินค้าที่สาขาเท่านั้น)"
"Some of the products are currently out of stock","มีสินค้าบ้างรายการหมดสต็อก"
"Already have an account?","คุณเคยมีบัญชีอยู่แล้วหรือไม่"
"Continue Checkout","กลับสู่ขั้นตอนการชำระเงิน"
"The address has been saved.","ที่อยู่ได้รับการบันทึกเรียบร้อยแล้ว"
"Coupon code ""%s"" is not valid.","รหัสคูปอง ""%s"" ไม่ถูกต้อง"
"Coupon code %s was canceled.","รหัสคูปอง %s ถูกยกเลิก"
"Coupon code ""%s"" was applied.","รหัสคูปอง ""%s"" ถูกใช้งาน"
"Return to cart","กลับ ตะกร้า"
"Expected delivery date: %s","วันที่ส่งสินค้า : %s"
"Expected delivery in %s days","ระยะเวลาส่งสินค้าใน %s วัน"
"Information","ข้อมูล"
"Information join","ข้อมูลการลงทะเบียน"
"Express","ส่งแบบด่วน"
"Stardard","ส่งแบบมาตรฐาน"
"Standard","ส่งแบบมาตรฐาน"
"Pick-up Points","รับสินค้าที่สาขา"
"Update Cart","อัพเดทตะกร้า"
"Company Name","ชื่อบริษัท"
"Head Quarter / Personal","สำนักงานใหญ่ / บุคคลธรรมดา"
"normal","ส่งแบบปกติ"
"ems","ส่งแบบ ems"
"Please enter your personal information below.","กรุณากรอกข้อมูลส่วนตัวของคุณด้านล่าง"
"No Invoice Needed","ไม่ต้องการใบกำกับภาษี"
"Grand Total (Excl.Tax)","ราคารวม (ไม่รวมภาษี)"
"Grand Total (Incl.Tax)","ราคารวม (รวมภาษี)"
"Order No. %s","หมายเลขสั่งซื้อ %s"
"you may interested in the following items","คุณอาจสนใจในสินค้าดังต่อไปนี้"
"Overall","ทั้งหมด"
"detailed","รายละเอียด"
"description","ลักษณะ"
"Buy now","สั่งซื้อเลย"
"Share:","แบ่งปัน:"
"Comment","คำอธิบาย"
"Good news, you can use your Cdiscount account to check your orders and enjoy a new ecommerce experience on Cmart! You just have to <a href=""%s"">reset your password</a>. Thank you!","สะดวก ง่าย ไม่ต้องสมัครสมาชิกใหม่! ลูกค้า Cdiscount สามารถช้อปปิ้งที่  Cmart ได้ทันที่ เพียงแค่ <a href=""%s"">เปลี่ยนรหัสผ่าน</a> เท่านั้น!!!"
"My newsletter","จดหมายข่าวของฉัน"
"My Newsletter","จดหมายข่าวของฉัน"
"My account & password ","บัญชีและรหัสผ่านของฉัน"
"Subscribe!","สมัครสมาชิกจดหมายข่าว"
"Products","สินค้า"
